{
  "id": "EI-DOTNET-001",
  "name": "ASP.NET Core REST API Standard",
  "version": "1.0.0",
  "type": "STANDARD",
  "scope": "PROJECT",
  "status": "ACTIVE",
  "technology": "ASP.NET Core",
  "technologyVersion": "8.0",
  "source": "REPOSITORY_DEFINED",
  "description": "Standard REST API contracts, error handling, and security policies for .NET services.",
  "rules": [
    {
      "ruleId": "RULE-API-001",
      "severity": "MANDATORY",
      "statement": "All API responses must use RFC 7807 ProblemDetails format on error.",
      "action": "ENFORCE"
    },
    {
      "ruleId": "RULE-API-002",
      "severity": "RECOMMENDED",
      "statement": "Use AsNoTracking on read-only queries.",
      "action": "SUGGEST"
    }
  ],
  "evidence": [
    {
      "file": "src/WebApi/Program.cs",
      "reason": "TargetFramework=net8.0 and AddProblemDetails() configured"
    }
  ],
  "dependencies": ["EI-DOTNET-BASE"],
  "exceptions": [
    {
      "exceptionId": "EXC-001",
      "ruleId": "RULE-API-001",
      "scope": "MODULE:LegacyGateway",
      "reason": "Upstream client requires legacy XML responses.",
      "decision": "APPROVED",
      "approvedBy": "Architect",
      "status": "ACTIVE",
      "expiresAt": "2026-12-31T23:59:59Z"
    }
  ],
  "snapshots": [
    {
      "snapshotId": "SNAP-101",
      "workItemId": "101",
      "timestamp": "2026-09-27T10:00:00Z",
      "technologies": ["ASP.NET Core 8.0"],
      "rulesApplied": ["RULE-API-001"]
    }
  ],
  "metrics": {
    "rulesAvailable": 12,
    "rulesMatched": 4,
    "rulesProvidedToModel": 2,
    "skillsUsed": 1,
    "policiesApplied": 1,
    "standardsApplied": 1
  },
  "created_at": "2026-09-27T10:00:00Z",
  "updated_at": "2026-09-27T10:00:00Z"
}
